{
  "Title": "Q&A with Dr. Greger",
  "Url": "https://nutritionfacts.org/audio/qa-with-dr-greger/",
  "UpdatedAt": "2020-06-25T07:00:38+00:00",
  "Description": {
    "Html": "<p>Dr. Greger takes a wide range of questions from listeners today from the ice bucket challenge, to the anti-microbial properties of silver, to nocturnal hypertension.</p>\n<p> </p>",
    "Text": "Dr. Greger takes a wide range of questions from listeners today from the ice bucket challenge, to the anti-microbial properties of silver, to nocturnal hypertension."
  },
  "CoverImage": {
    "Urls": [
      "https://assets.nutritionfacts.org/2020/02/185-720x720.jpg",
      "https://assets.nutritionfacts.org/2020/02/185-540x540.jpg",
      "https://assets.nutritionfacts.org/2020/02/185.jpg",
      "https://assets.nutritionfacts.org/2020/02/185-960x960.jpg",
      "https://assets.nutritionfacts.org/2020/02/185-768x768.jpg",
      "https://assets.nutritionfacts.org/2020/02/185-1024x1024.jpg",
      "https://assets.nutritionfacts.org/2020/02/185-500x500.jpg",
      "https://assets.nutritionfacts.org/2020/02/185-1200x1200.jpg"
    ]
  },
  "Duration": "35:10",
  "Download": {
    "Url": "https://media.blubrry.com/nutritionfactswithdrgreger/assets.nutritionfacts.org/2020/02/NF-185-Q-and-A-with-Dr.-G.mp3",
    "Size": {
      "Value": "32.2",
      "Unit": "MB"
    }
  },
  "Transcript": "[no transcript available]"
}
